================================================================================
SESSION STARTED
================================================================================
  Session ID: 2467a44a-184c-4bf7-9c5f-1e800176a4f3
  Model: claude-opus-4-5-20251101
  Working Dir: /Users/josh/code/sow/.sow/worktrees/feat/libsproject-module-118
  Claude Code: v2.0.64
  Permission Mode: bypassPermissions

--------------------------------------------------------------------------------
TOOL: Bash
--------------------------------------------------------------------------------
  Description: Load implementer base instructions
  Command: sow prompt guidance/implementer/base

--------------------------------------------------------------------------------
RESULT [OK]
--------------------------------------------------------------------------------
  # Implementer Agent - Base Instructions

  You are a software implementer. Your sole purpose is to implement what is specified—nothing more, nothing less.

  ## Immediate Actions

  Follow these steps in order:

  ### 1. Read Task State

  Read: `.sow/project/phases/implementation/tasks/{id}/state.yaml`

  Or use command: `sow task status --id {id}`

  Check:
  - **iteration**: What iteration are you on? (1 = first attempt, 2+ = addressing feedback)
  - **assigned_agent**: Confirm you're the right agent
  - **inputs**: Context files and feedback the orchestrator wants you to review
    - Look for inputs with `type: reference` (context files)
    - Look for inputs with `type: feedback` (review feedback from previous iterations)

  ### 2. Read Requirements

  Read: `.sow/project/phases/implementation/tasks/{id}/description.md`

  Understand:
  - What needs to be done
  - Acceptance criteria
  - Any specific constraints or requirements
  - Task scenario type (see detection heuristics below)

  **CRITICAL: Validate Task Descri
    ... [truncated, 8887 total chars]

--------------------------------------------------------------------------------
TOOL: Read
--------------------------------------------------------------------------------
  File: /Users/josh/code/sow/.sow/worktrees/feat/libsproject-module-118/.sow/project/phases/implementation/tasks/100/state.yaml

--------------------------------------------------------------------------------
TOOL: Read
--------------------------------------------------------------------------------
  File: /Users/josh/code/sow/.sow/worktrees/feat/libsproject-module-118/.sow/project/phases/implementation/tasks/100/description.md

--------------------------------------------------------------------------------
RESULT [OK]
--------------------------------------------------------------------------------

--------------------------------------------------------------------------------
TOOL: Bash
--------------------------------------------------------------------------------
  Description: Check task status and inputs
  Command: sow task status --id 100

--------------------------------------------------------------------------------
RESULT [OK]
--------------------------------------------------------------------------------
  Task: 100 - Add README and final cleanup
  Phase: implementation
  Status: pending
  Iteration: 1
  Assigned Agent: implementer

  Timestamps:
    Created:   2025-12-10 09:14:22
    Updated:   2025-12-10 09:15:18

  Inputs (2):
    [0] reference: libs/config/README.md
    [1] reference: .standards/STYLE.md

  Files:
    Description: .sow/project/phases/implementation/tasks/100/description.md
    Log:         .sow/project/phases/implementation/tasks/100/log.md
    Feedback:    .sow/project/phases/implementation/tasks/100/feedback/

--------------------------------------------------------------------------------
TOOL: TodoWrite
--------------------------------------------------------------------------------
  Todos:
    [>] Read reference inputs (libs/config/README.md, .standards/STYLE.md)
    [ ] Run linting and tests to understand current state
    [ ] Create libs/project/README.md
    [ ] Create libs/project/state/README.md
    [ ] Fix any lint issues in libs/project
    [ ] Fix any lint issues in cli
    [ ] Run full test suite and fix any failures
    [ ] Final code review and cleanup

--------------------------------------------------------------------------------
RESULT [OK]
--------------------------------------------------------------------------------

--------------------------------------------------------------------------------
TOOL: Read
--------------------------------------------------------------------------------
  File: /Users/josh/code/sow/.sow/worktrees/feat/libsproject-module-118/libs/config/README.md

--------------------------------------------------------------------------------
TOOL: Read
--------------------------------------------------------------------------------
  File: /Users/josh/code/sow/.sow/worktrees/feat/libsproject-module-118/.standards/STYLE.md

--------------------------------------------------------------------------------
RESULT [OK]
--------------------------------------------------------------------------------

--------------------------------------------------------------------------------
RESULT [OK]
--------------------------------------------------------------------------------

--------------------------------------------------------------------------------
TOOL: TodoWrite
--------------------------------------------------------------------------------
  Todos:
    [x] Read reference inputs (libs/config/README.md, .standards/STYLE.md)
    [>] Run linting and tests to understand current state
    [ ] Create libs/project/README.md
    [ ] Create libs/project/state/README.md
    [ ] Fix any lint issues in libs/project
    [ ] Fix any lint issues in cli
    [ ] Run full test suite and fix any failures
    [ ] Final code review and cleanup

--------------------------------------------------------------------------------
RESULT [OK]
--------------------------------------------------------------------------------

--------------------------------------------------------------------------------
TOOL: Bash
--------------------------------------------------------------------------------
  Description: Run golangci-lint on libs/project
  Command: cd /Users/josh/code/sow/.sow/worktrees/feat/libsproject-module-118/libs/project && golangci-lint run ./... 2>&1 | head -100

--------------------------------------------------------------------------------
TOOL: Bash
--------------------------------------------------------------------------------
  Description: Run golangci-lint on cli
  Command: cd /Users/josh/code/sow/.sow/worktrees/feat/libsproject-module-118/cli && golangci-lint run ./... 2>&1 | head -100

--------------------------------------------------------------------------------
RESULT [OK]
--------------------------------------------------------------------------------
  0 issues.

--------------------------------------------------------------------------------
RESULT [OK]
--------------------------------------------------------------------------------
  internal/cmdutil/context.go:47:9: error returned from external package is unwrapped: sig: func github.com/jmgilman/sow/libs/project/state.Load(ctx context.Context, backend github.com/jmgilman/sow/libs/project/state.Backend) (*github.com/jmgilman/sow/libs/project/state.Project, error) (wrapcheck)
  	return state.Load(ctx, backend)
  	       ^
  internal/cmdutil/context.go:53:9: error returned from external package is unwrapped: sig: func github.com/jmgilman/sow/libs/project/state.Save(ctx context.Context, p *github.com/jmgilman/sow/libs/project/state.Project) error (wrapcheck)
  	return state.Save(ctx, proj)
  	       ^
  internal/cmdutil/context.go:60:9: error returned from external package is unwrapped: sig: func github.com/jmgilman/sow/libs/project/state.Create(ctx context.Context, backend github.com/jmgilman/sow/libs/project/state.Backend, opts github.com/jmgilman/sow/libs/project/state.CreateOpts) (*github.com/jmgilman/sow/libs/project/state.Project, error) (wrapcheck)
  	return state.Create(ctx
    ... [truncated, 1051 total chars]

--------------------------------------------------------------------------------
TOOL: Bash
--------------------------------------------------------------------------------
  Description: Run tests on libs/project
  Command: cd /Users/josh/code/sow/.sow/worktrees/feat/libsproject-module-118/libs/project && go test -race -v ./... 2>&1 | tail -50

--------------------------------------------------------------------------------
TOOL: Bash
--------------------------------------------------------------------------------
  Description: Run tests on cli
  Command: go test -race -v ./... 2>&1 | tail -100

--------------------------------------------------------------------------------
RESULT [OK]
--------------------------------------------------------------------------------
  === RUN   TestTask_EmbeddedState
  === RUN   TestTask_EmbeddedState/embeds_TaskState_fields
  === RUN   TestTask_EmbeddedState/accesses_nested_inputs_and_outputs
  --- PASS: TestTask_EmbeddedState (0.00s)
      --- PASS: TestTask_EmbeddedState/embeds_TaskState_fields (0.00s)
      --- PASS: TestTask_EmbeddedState/accesses_nested_inputs_and_outputs (0.00s)
  === RUN   TestValidateStructure_ValidState
  --- PASS: TestValidateStructure_ValidState (0.00s)
  === RUN   TestValidateStructure_MissingRequiredFields
  === RUN   TestValidateStructure_MissingRequiredFields/empty_name
  === RUN   TestValidateStructure_MissingRequiredFields/empty_type
  === RUN   TestValidateStructure_MissingRequiredFields/empty_branch
  === RUN   TestValidateStructure_MissingRequiredFields/empty_current_state
  --- PASS: TestValidateStructure_MissingRequiredFields (0.00s)
      --- PASS: TestValidateStructure_MissingRequiredFields/empty_name (0.00s)
      --- PASS: TestValidateStructure_MissingRequiredFields/empty_type (0.00s)
      --- PASS: Tes
    ... [truncated, 3275 total chars]

--------------------------------------------------------------------------------
RESULT [OK]
--------------------------------------------------------------------------------
  === RUN   TestProject_PhaseMetadataBool/returns_false_when_metadata_is_nil
  === RUN   TestProject_PhaseMetadataBool/returns_false_when_key_not_found
  === RUN   TestProject_PhaseMetadataBool/returns_false_when_value_is_not_bool
  === RUN   TestProject_PhaseMetadataBool/returns_false_when_bool_value_is_false
  === RUN   TestProject_PhaseMetadataBool/returns_true_when_bool_value_is_true
  --- PASS: TestProject_PhaseMetadataBool (0.00s)
      --- PASS: TestProject_PhaseMetadataBool/returns_false_when_phase_not_found (0.00s)
      --- PASS: TestProject_PhaseMetadataBool/returns_false_when_metadata_is_nil (0.00s)
      --- PASS: TestProject_PhaseMetadataBool/returns_false_when_key_not_found (0.00s)
      --- PASS: TestProject_PhaseMetadataBool/returns_false_when_value_is_not_bool (0.00s)
      --- PASS: TestProject_PhaseMetadataBool/returns_false_when_bool_value_is_false (0.00s)
      --- PASS: TestProject_PhaseMetadataBool/returns_true_when_bool_value_is_true (0.00s)
  === RUN   TestProject_AllTasksComplete
  === 
    ... [truncated, 6458 total chars]

--------------------------------------------------------------------------------
TOOL: Bash
--------------------------------------------------------------------------------
  Description: Check test results in cli
  Command: cd /Users/josh/code/sow/.sow/worktrees/feat/libsproject-module-118/cli && go test -race -v ./... 2>&1 | grep -E "(PASS|FAIL|---)" | tail -50

--------------------------------------------------------------------------------
RESULT [OK]
--------------------------------------------------------------------------------
      --- PASS: TestInferTypeFromURL/git_SSH_shorthand (0.00s)
      --- PASS: TestInferTypeFromURL/file_URL (0.00s)
      --- PASS: TestInferTypeFromURL/https_without_git_prefix (0.00s)
      --- PASS: TestInferTypeFromURL/invalid_URL (0.00s)
  --- PASS: TestNormalizeGitURL (0.00s)
      --- PASS: TestNormalizeGitURL/SSH_shorthand (0.00s)
      --- PASS: TestNormalizeGitURL/SSH_shorthand_with_dots_in_username (0.00s)
      --- PASS: TestNormalizeGitURL/HTTPS_without_prefix (0.00s)
      --- PASS: TestNormalizeGitURL/HTTP_without_prefix (0.00s)
      --- PASS: TestNormalizeGitURL/SSH_without_prefix (0.00s)
      --- PASS: TestNormalizeGitURL/Already_normalized_git+https (0.00s)
      --- PASS: TestNormalizeGitURL/Already_normalized_git+ssh (0.00s)
      --- PASS: TestNormalizeGitURL/Invalid_SSH_shorthand (0.00s)
      --- PASS: TestNormalizeGitURL/Local_git_repo_via_file_URL (0.00s)
  --- PASS: TestParseGitURL (0.00s)
      --- PASS: TestParseGitURL/SSH_shorthand (0.00s)
      --- PASS: TestParseGitURL/HTTPS_URL (0.00s
    ... [truncated, 2620 total chars]

--------------------------------------------------------------------------------
THINKING
--------------------------------------------------------------------------------
  All tests pass. Now I need to fix the CLI lint issues and create the README files. Let me first fix the lint issues in the CLI.

--------------------------------------------------------------------------------
TOOL: TodoWrite
--------------------------------------------------------------------------------
  Todos:
    [x] Read reference inputs (libs/config/README.md, .standards/STYLE.md)
    [x] Run linting and tests to understand current state
    [ ] Create libs/project/README.md
    [ ] Create libs/project/state/README.md
    [x] Fix any lint issues in libs/project
    [>] Fix lint issues in cli (3 wrapcheck errors)
    [ ] Run full test suite and fix any failures
    [ ] Final code review and cleanup

--------------------------------------------------------------------------------
RESULT [OK]
--------------------------------------------------------------------------------

--------------------------------------------------------------------------------
TOOL: Read
--------------------------------------------------------------------------------
  File: /Users/josh/code/sow/.sow/worktrees/feat/libsproject-module-118/cli/internal/cmdutil/context.go

--------------------------------------------------------------------------------
RESULT [OK]
--------------------------------------------------------------------------------

--------------------------------------------------------------------------------
TOOL: Edit
--------------------------------------------------------------------------------
  File: /Users/josh/code/sow/.sow/worktrees/feat/libsproject-module-118/cli/internal/cmdutil/context.go
  Replacing: import ( 	"context"  	"github.com/jmgilman/sow/cli/internal/sow" 	"github.com/jmgilman/sow/libs/proj...

--------------------------------------------------------------------------------
RESULT [OK]
--------------------------------------------------------------------------------

--------------------------------------------------------------------------------
TOOL: Edit
--------------------------------------------------------------------------------
  File: /Users/josh/code/sow/.sow/worktrees/feat/libsproject-module-118/cli/internal/cmdutil/context.go
  Replacing: // LoadProject loads the project from the sow context's filesystem. // This is a convenience wrapper...

--------------------------------------------------------------------------------
RESULT [OK]
--------------------------------------------------------------------------------

--------------------------------------------------------------------------------
TOOL: Edit
--------------------------------------------------------------------------------
  File: /Users/josh/code/sow/.sow/worktrees/feat/libsproject-module-118/cli/internal/cmdutil/context.go
  Replacing: // SaveProject saves the project to the sow context's filesystem. // This is a convenience wrapper a...

--------------------------------------------------------------------------------
RESULT [OK]
--------------------------------------------------------------------------------

--------------------------------------------------------------------------------
TOOL: Edit
--------------------------------------------------------------------------------
  File: /Users/josh/code/sow/.sow/worktrees/feat/libsproject-module-118/cli/internal/cmdutil/context.go
  Replacing: // CreateProject creates a new project and saves it. // This is a convenience wrapper around state.C...

--------------------------------------------------------------------------------
RESULT [OK]
--------------------------------------------------------------------------------

--------------------------------------------------------------------------------
TOOL: Bash
--------------------------------------------------------------------------------
  Description: Re-run linting on cli
  Command: golangci-lint run ./... 2>&1

--------------------------------------------------------------------------------
RESULT [OK]
--------------------------------------------------------------------------------
  0 issues.

--------------------------------------------------------------------------------
TOOL: TodoWrite
--------------------------------------------------------------------------------
  Todos:
    [x] Read reference inputs (libs/config/README.md, .standards/STYLE.md)
    [x] Run linting and tests to understand current state
    [>] Create libs/project/README.md
    [ ] Create libs/project/state/README.md
    [x] Fix any lint issues in libs/project
    [x] Fix lint issues in cli (3 wrapcheck errors)
    [ ] Run full test suite and fix any failures
    [ ] Final code review and cleanup

--------------------------------------------------------------------------------
RESULT [OK]
--------------------------------------------------------------------------------

--------------------------------------------------------------------------------
THINKING
--------------------------------------------------------------------------------
  Now let me explore the libs/project module to understand its actual structure for creating accurate README documentation.

--------------------------------------------------------------------------------
TOOL: Glob
--------------------------------------------------------------------------------
  Pattern: libs/project/**/*.go
  Path: /Users/josh/code/sow/.sow/worktrees/feat/libsproject-module-118

--------------------------------------------------------------------------------
RESULT [OK]
--------------------------------------------------------------------------------

--------------------------------------------------------------------------------
TOOL: Read
--------------------------------------------------------------------------------
  File: /Users/josh/code/sow/.sow/worktrees/feat/libsproject-module-118/libs/project/doc.go

--------------------------------------------------------------------------------
TOOL: Read
--------------------------------------------------------------------------------
  File: /Users/josh/code/sow/.sow/worktrees/feat/libsproject-module-118/libs/project/state/doc.go

--------------------------------------------------------------------------------
TOOL: Read
--------------------------------------------------------------------------------
  File: /Users/josh/code/sow/.sow/worktrees/feat/libsproject-module-118/libs/project/config.go

--------------------------------------------------------------------------------
TOOL: Read
--------------------------------------------------------------------------------
  File: /Users/josh/code/sow/.sow/worktrees/feat/libsproject-module-118/libs/project/types.go

--------------------------------------------------------------------------------
RESULT [OK]
--------------------------------------------------------------------------------

--------------------------------------------------------------------------------
RESULT [OK]
--------------------------------------------------------------------------------

--------------------------------------------------------------------------------
RESULT [OK]
--------------------------------------------------------------------------------

--------------------------------------------------------------------------------
RESULT [OK]
--------------------------------------------------------------------------------

--------------------------------------------------------------------------------
TOOL: Read
--------------------------------------------------------------------------------
  File: /Users/josh/code/sow/.sow/worktrees/feat/libsproject-module-118/libs/project/builder.go

--------------------------------------------------------------------------------
TOOL: Read
--------------------------------------------------------------------------------
  File: /Users/josh/code/sow/.sow/worktrees/feat/libsproject-module-118/libs/project/project_builder.go

--------------------------------------------------------------------------------
TOOL: Read
--------------------------------------------------------------------------------
  File: /Users/josh/code/sow/.sow/worktrees/feat/libsproject-module-118/libs/project/state/loader.go

--------------------------------------------------------------------------------
TOOL: Read
--------------------------------------------------------------------------------
  File: /Users/josh/code/sow/.sow/worktrees/feat/libsproject-module-118/libs/project/state/backend.go

--------------------------------------------------------------------------------
RESULT [OK]
--------------------------------------------------------------------------------

--------------------------------------------------------------------------------
RESULT [OK]
--------------------------------------------------------------------------------

--------------------------------------------------------------------------------
RESULT [OK]
--------------------------------------------------------------------------------

--------------------------------------------------------------------------------
RESULT [OK]
--------------------------------------------------------------------------------

--------------------------------------------------------------------------------
TOOL: Read
--------------------------------------------------------------------------------
  File: /Users/josh/code/sow/.sow/worktrees/feat/libsproject-module-118/libs/project/state/project.go

--------------------------------------------------------------------------------
TOOL: Read
--------------------------------------------------------------------------------
  File: /Users/josh/code/sow/.sow/worktrees/feat/libsproject-module-118/libs/project/machine.go

--------------------------------------------------------------------------------
RESULT [OK]
--------------------------------------------------------------------------------

--------------------------------------------------------------------------------
RESULT [OK]
--------------------------------------------------------------------------------

--------------------------------------------------------------------------------
THINKING
--------------------------------------------------------------------------------
  Now I have enough context to create the README files. Let me create `libs/project/README.md` first:

--------------------------------------------------------------------------------
TOOL: Write
--------------------------------------------------------------------------------
  File: /Users/josh/code/sow/.sow/worktrees/feat/libsproject-module-118/libs/project/README.md
  Content: 262 lines

--------------------------------------------------------------------------------
RESULT [OK]
--------------------------------------------------------------------------------

--------------------------------------------------------------------------------
TOOL: TodoWrite
--------------------------------------------------------------------------------
  Todos:
    [x] Read reference inputs (libs/config/README.md, .standards/STYLE.md)
    [x] Run linting and tests to understand current state
    [x] Create libs/project/README.md
    [>] Create libs/project/state/README.md
    [x] Fix any lint issues in libs/project
    [x] Fix lint issues in cli (3 wrapcheck errors)
    [ ] Run full test suite and fix any failures
    [ ] Final code review and cleanup

--------------------------------------------------------------------------------
RESULT [OK]
--------------------------------------------------------------------------------

--------------------------------------------------------------------------------
TOOL: Write
--------------------------------------------------------------------------------
  File: /Users/josh/code/sow/.sow/worktrees/feat/libsproject-module-118/libs/project/state/README.md
  Content: 122 lines

--------------------------------------------------------------------------------
RESULT [OK]
--------------------------------------------------------------------------------

--------------------------------------------------------------------------------
TOOL: TodoWrite
--------------------------------------------------------------------------------
  Todos:
    [x] Read reference inputs (libs/config/README.md, .standards/STYLE.md)
    [x] Run linting and tests to understand current state
    [x] Create libs/project/README.md
    [x] Create libs/project/state/README.md
    [x] Fix any lint issues in libs/project
    [x] Fix lint issues in cli (3 wrapcheck errors)
    [>] Run full test suite and fix any failures
    [ ] Final code review and cleanup

--------------------------------------------------------------------------------
RESULT [OK]
--------------------------------------------------------------------------------

--------------------------------------------------------------------------------
TOOL: Bash
--------------------------------------------------------------------------------
  Description: Run lint on libs/project
  Command: cd /Users/josh/code/sow/.sow/worktrees/feat/libsproject-module-118/libs/project && golangci-lint run ./... 2>&1

--------------------------------------------------------------------------------
TOOL: Bash
--------------------------------------------------------------------------------
  Description: Run lint on cli
  Command: golangci-lint run ./... 2>&1

--------------------------------------------------------------------------------
RESULT [OK]
--------------------------------------------------------------------------------
  0 issues.

--------------------------------------------------------------------------------
RESULT [OK]
--------------------------------------------------------------------------------
  0 issues.

--------------------------------------------------------------------------------
TOOL: Bash
--------------------------------------------------------------------------------
  Description: Run tests on libs/project
  Command: go test -race ./... 2>&1

--------------------------------------------------------------------------------
TOOL: Bash
--------------------------------------------------------------------------------
  Description: Run tests on cli
  Command: go test -race ./... 2>&1

--------------------------------------------------------------------------------
RESULT [OK]
--------------------------------------------------------------------------------
  ok  	github.com/jmgilman/sow/libs/project	(cached)
  ok  	github.com/jmgilman/sow/libs/project/state	(cached)

--------------------------------------------------------------------------------
RESULT [OK]
--------------------------------------------------------------------------------
  ok  	github.com/jmgilman/sow/libs/project	(cached)
  ok  	github.com/jmgilman/sow/libs/project/state	(cached)

--------------------------------------------------------------------------------
TOOL: Bash
--------------------------------------------------------------------------------
  Description: Run tests without cache
  Command: go test -race -count=1 ./... 2>&1

--------------------------------------------------------------------------------
RESULT [OK]
--------------------------------------------------------------------------------
  ok  	github.com/jmgilman/sow/libs/project	1.291s
  ok  	github.com/jmgilman/sow/libs/project/state	1.505s

--------------------------------------------------------------------------------
TOOL: Bash
--------------------------------------------------------------------------------
  Description: Run CLI tests without cache
  Command: go test -race -count=1 -v ./... 2>&1 | tail -30

--------------------------------------------------------------------------------
RESULT [OK]
--------------------------------------------------------------------------------
  === RUN   TestValidateStructure_InvalidFieldValues/invalid_name_-_starts_with_hyphen
  === RUN   TestValidateStructure_InvalidFieldValues/invalid_type_-_uppercase
  === RUN   TestValidateStructure_InvalidFieldValues/invalid_type_-_contains_hyphen
  --- PASS: TestValidateStructure_InvalidFieldValues (0.00s)
      --- PASS: TestValidateStructure_InvalidFieldValues/invalid_name_-_uppercase (0.00s)
      --- PASS: TestValidateStructure_InvalidFieldValues/invalid_name_-_starts_with_hyphen (0.00s)
      --- PASS: TestValidateStructure_InvalidFieldValues/invalid_type_-_uppercase (0.00s)
      --- PASS: TestValidateStructure_InvalidFieldValues/invalid_type_-_contains_hyphen (0.00s)
  === RUN   TestValidateMetadata
  === RUN   TestValidateMetadata/passes_for_valid_metadata
  === RUN   TestValidateMetadata/skips_validation_if_schema_is_empty
  === RUN   TestValidateMetadata/fails_for_invalid_metadata
  === RUN   TestValidateMetadata/fails_for_missing_required_fields
  --- PASS: TestValidateMetadata (0.00s)
      --- PASS: 
    ... [truncated, 2000 total chars]

--------------------------------------------------------------------------------
THINKING
--------------------------------------------------------------------------------
  All tests pass. Now let me run the full CLI test suite to verify integration:

--------------------------------------------------------------------------------
TOOL: Bash
--------------------------------------------------------------------------------
  Description: Run CLI tests
  Command: cd /Users/josh/code/sow/.sow/worktrees/feat/libsproject-module-118/cli && go test -race -count=1 ./... 2>&1 | tail -30

--------------------------------------------------------------------------------
RESULT [OK]
--------------------------------------------------------------------------------
  ok  	github.com/jmgilman/sow/cli	4.697s
  ok  	github.com/jmgilman/sow/cli/cmd	1.352s
  ok  	github.com/jmgilman/sow/cli/cmd/agent	2.854s
  ok  	github.com/jmgilman/sow/cli/cmd/config	1.931s
  ?   	github.com/jmgilman/sow/cli/cmd/issue	[no test files]
  ok  	github.com/jmgilman/sow/cli/cmd/project	12.551s
  ?   	github.com/jmgilman/sow/cli/cmd/refs	[no test files]
  ok  	github.com/jmgilman/sow/cli/internal	1.763s
  ok  	github.com/jmgilman/sow/cli/internal/agents	1.935s
  ok  	github.com/jmgilman/sow/cli/internal/agents/logformat	3.495s
  ok  	github.com/jmgilman/sow/cli/internal/cmdutil	3.375s
  ?   	github.com/jmgilman/sow/cli/internal/logging	[no test files]
  ok  	github.com/jmgilman/sow/cli/internal/projects/breakdown	2.143s
  ok  	github.com/jmgilman/sow/cli/internal/projects/design	2.723s
  ok  	github.com/jmgilman/sow/cli/internal/projects/exploration	2.537s
  ok  	github.com/jmgilman/sow/cli/internal/projects/standard	2.325s
  ?   	github.com/jmgilman/sow/cli/internal/prompts	[no test files]
  ok  	github.com
    ... [truncated, 1159 total chars]

--------------------------------------------------------------------------------
TOOL: TodoWrite
--------------------------------------------------------------------------------
  Todos:
    [x] Read reference inputs (libs/config/README.md, .standards/STYLE.md)
    [x] Run linting and tests to understand current state
    [x] Create libs/project/README.md
    [x] Create libs/project/state/README.md
    [x] Fix any lint issues in libs/project
    [x] Fix lint issues in cli (3 wrapcheck errors)
    [x] Run full test suite and fix any failures
    [>] Final code review and cleanup

--------------------------------------------------------------------------------
RESULT [OK]
--------------------------------------------------------------------------------

--------------------------------------------------------------------------------
THINKING
--------------------------------------------------------------------------------
  Now let me do a final code review to check for any missing doc comments, unused code, or issues:

--------------------------------------------------------------------------------
TOOL: Glob
--------------------------------------------------------------------------------
  Pattern: libs/project/**/*.go
  Path: /Users/josh/code/sow/.sow/worktrees/feat/libsproject-module-118

--------------------------------------------------------------------------------
RESULT [OK]
--------------------------------------------------------------------------------

--------------------------------------------------------------------------------
THINKING
--------------------------------------------------------------------------------
  Let me check a few non-test files for doc comments:

--------------------------------------------------------------------------------
TOOL: Read
--------------------------------------------------------------------------------
  File: /Users/josh/code/sow/.sow/worktrees/feat/libsproject-module-118/libs/project/options.go

--------------------------------------------------------------------------------
TOOL: Read
--------------------------------------------------------------------------------
  File: /Users/josh/code/sow/.sow/worktrees/feat/libsproject-module-118/libs/project/phase_config.go

--------------------------------------------------------------------------------
TOOL: Read
--------------------------------------------------------------------------------
  File: /Users/josh/code/sow/.sow/worktrees/feat/libsproject-module-118/libs/project/state/registry.go

--------------------------------------------------------------------------------
RESULT [OK]
--------------------------------------------------------------------------------

--------------------------------------------------------------------------------
RESULT [OK]
--------------------------------------------------------------------------------

--------------------------------------------------------------------------------
RESULT [OK]
--------------------------------------------------------------------------------

--------------------------------------------------------------------------------
THINKING
--------------------------------------------------------------------------------
  Let me also check some PhaseOpt functions for documentation:

--------------------------------------------------------------------------------
TOOL: Grep
--------------------------------------------------------------------------------
  Pattern: ^type PhaseOpt
  Path: /Users/josh/code/sow/.sow/worktrees/feat/libsproject-module-118/libs/project

--------------------------------------------------------------------------------
TOOL: Grep
--------------------------------------------------------------------------------
  Pattern: ^func (Start|End|Output|Input|Support|With).*PhaseOpt
  Path: /Users/josh/code/sow/.sow/worktrees/feat/libsproject-module-118/libs/project

--------------------------------------------------------------------------------
RESULT [OK]
--------------------------------------------------------------------------------

--------------------------------------------------------------------------------
RESULT [OK]
--------------------------------------------------------------------------------

--------------------------------------------------------------------------------
TOOL: Read
--------------------------------------------------------------------------------
  File: /Users/josh/code/sow/.sow/worktrees/feat/libsproject-module-118/libs/project/config_options.go

--------------------------------------------------------------------------------
RESULT [OK]
--------------------------------------------------------------------------------

--------------------------------------------------------------------------------
THINKING
--------------------------------------------------------------------------------
  All doc comments look good. Let me check if there's a CHANGELOG to update:

--------------------------------------------------------------------------------
TOOL: Bash
--------------------------------------------------------------------------------
  Description: Check for CHANGELOG
  Command: ls -la /Users/josh/code/sow/.sow/worktrees/feat/libsproject-module-118/ | grep -i changelog || echo "No CHANGELOG found"

--------------------------------------------------------------------------------
RESULT [OK]
--------------------------------------------------------------------------------
  .rw-r--r--  679 josh 10 Dec 08:21 CHANGELOG.md

--------------------------------------------------------------------------------
TOOL: Read
--------------------------------------------------------------------------------
  File: /Users/josh/code/sow/.sow/worktrees/feat/libsproject-module-118/CHANGELOG.md

--------------------------------------------------------------------------------
RESULT [OK]
--------------------------------------------------------------------------------

--------------------------------------------------------------------------------
TOOL: Edit
--------------------------------------------------------------------------------
  File: /Users/josh/code/sow/.sow/worktrees/feat/libsproject-module-118/CHANGELOG.md
  Replacing: ## [Unreleased]  ## [0.1.1]

--------------------------------------------------------------------------------
RESULT [OK]
--------------------------------------------------------------------------------

--------------------------------------------------------------------------------
THINKING
--------------------------------------------------------------------------------
  Let me run a final verification of all tests and linting:

--------------------------------------------------------------------------------
TOOL: Bash
--------------------------------------------------------------------------------
  Description: Final lint check
  Command: cd /Users/josh/code/sow/.sow/worktrees/feat/libsproject-module-118 && golangci-lint run ./libs/project/... ./cli/... 2>&1

--------------------------------------------------------------------------------
TOOL: Bash
--------------------------------------------------------------------------------
  Description: Final lint check for libs/project
  Command: cd /Users/josh/code/sow/.sow/worktrees/feat/libsproject-module-118/libs/project && golangci-lint run ./... 2>&1 && echo "libs/project OK"

--------------------------------------------------------------------------------
TOOL: Bash
--------------------------------------------------------------------------------
  Description: Final lint check for cli
  Command: golangci-lint run ./... 2>&1 && echo "cli OK"

--------------------------------------------------------------------------------
RESULT [OK]
--------------------------------------------------------------------------------
  0 issues.
  libs/project OK

--------------------------------------------------------------------------------
RESULT [OK]
--------------------------------------------------------------------------------
  0 issues.
  cli OK

--------------------------------------------------------------------------------
TOOL: Bash
--------------------------------------------------------------------------------
  Description: Final test check for libs/project
  Command: go test -race ./... 2>&1

--------------------------------------------------------------------------------
TOOL: Bash
--------------------------------------------------------------------------------
  Description: Final test check for cli
  Command: go test -race ./... 2>&1

--------------------------------------------------------------------------------
RESULT [OK]
--------------------------------------------------------------------------------
  ok  	github.com/jmgilman/sow/libs/project	(cached)
  ok  	github.com/jmgilman/sow/libs/project/state	(cached)

--------------------------------------------------------------------------------
RESULT [OK]
--------------------------------------------------------------------------------
  ok  	github.com/jmgilman/sow/libs/project	(cached)
  ok  	github.com/jmgilman/sow/libs/project/state	(cached)

--------------------------------------------------------------------------------
TOOL: Bash
--------------------------------------------------------------------------------
  Description: Final CLI tests
  Command: cd /Users/josh/code/sow/.sow/worktrees/feat/libsproject-module-118/cli && go test -race ./... 2>&1 | grep -E "(ok|FAIL)" | head -30

--------------------------------------------------------------------------------
RESULT [OK]
--------------------------------------------------------------------------------
  ok  	github.com/jmgilman/sow/cli	4.751s
  ok  	github.com/jmgilman/sow/cli/cmd	1.501s
  ok  	github.com/jmgilman/sow/cli/cmd/agent	3.037s
  ok  	github.com/jmgilman/sow/cli/cmd/config	(cached)
  ok  	github.com/jmgilman/sow/cli/cmd/project	13.193s
  ok  	github.com/jmgilman/sow/cli/internal	(cached)
  ok  	github.com/jmgilman/sow/cli/internal/agents	(cached)
  ok  	github.com/jmgilman/sow/cli/internal/agents/logformat	(cached)
  ok  	github.com/jmgilman/sow/cli/internal/cmdutil	2.161s
  ok  	github.com/jmgilman/sow/cli/internal/projects/breakdown	(cached)
  ok  	github.com/jmgilman/sow/cli/internal/projects/design	(cached)
  ok  	github.com/jmgilman/sow/cli/internal/projects/exploration	(cached)
  ok  	github.com/jmgilman/sow/cli/internal/projects/standard	(cached)
  ok  	github.com/jmgilman/sow/cli/internal/refs	(cached)
  ok  	github.com/jmgilman/sow/cli/internal/sow	(cached)

--------------------------------------------------------------------------------
THINKING
--------------------------------------------------------------------------------
  All tests pass and linting is clean. Let me now complete the task and log my actions:

--------------------------------------------------------------------------------
TOOL: TodoWrite
--------------------------------------------------------------------------------
  Todos:
    [x] Read reference inputs (libs/config/README.md, .standards/STYLE.md)
    [x] Run linting and tests to understand current state
    [x] Create libs/project/README.md
    [x] Create libs/project/state/README.md
    [x] Fix any lint issues in libs/project
    [x] Fix lint issues in cli (3 wrapcheck errors)
    [x] Run full test suite and fix any failures
    [x] Final code review and cleanup

--------------------------------------------------------------------------------
RESULT [OK]
--------------------------------------------------------------------------------

--------------------------------------------------------------------------------
TOOL: Bash
--------------------------------------------------------------------------------
  Description: Log reference input reading
  Command: sow agent log -a "Read reference inputs" -r "Reviewed libs/config/README.md for README style and .standards/STYLE.md for code style requirements" -f libs/config/README.md -f .standards/STYLE.md

--------------------------------------------------------------------------------
TOOL: Bash
--------------------------------------------------------------------------------
  Description: Log lint fixes
  Command: sow agent log -a "Fixed CLI lint issues" -r "Wrapped errors from state.Load, state.Save, and state.Create in cli/internal/cmdutil/context.go to satisfy wrapcheck linter (3 issues)" -f cli/internal/cmd...

--------------------------------------------------------------------------------
TOOL: Bash
--------------------------------------------------------------------------------
  Description: Log README creation
  Command: sow agent log -a "Created libs/project/README.md" -r "Comprehensive README documenting project SDK with quick start, usage examples, package structure, and key concepts" -f libs/project/README.md

--------------------------------------------------------------------------------
TOOL: Bash
--------------------------------------------------------------------------------
  Description: Log state README creation
  Command: sow agent log -a "Created libs/project/state/README.md" -r "Concise README for state subpackage documenting types, backends, and usage patterns" -f libs/project/state/README.md

--------------------------------------------------------------------------------
TOOL: Bash
--------------------------------------------------------------------------------
  Description: Log CHANGELOG update
  Command: sow agent log -a "Updated CHANGELOG.md" -r "Added Unreleased section documenting libs/project module consolidation including added features, changes, and removed packages" -f CHANGELOG.md

--------------------------------------------------------------------------------
TOOL: Bash
--------------------------------------------------------------------------------
  Description: Log verification
  Command: sow agent log -a "Verified all tests and linting" -r "golangci-lint run ./... passes with 0 issues in both libs/project and cli; go test -race ./... passes for all packages"

--------------------------------------------------------------------------------
TOOL: Bash
--------------------------------------------------------------------------------
  Description: Get sow agent log help
  Command: sow agent log --help

--------------------------------------------------------------------------------
RESULT [OK]
--------------------------------------------------------------------------------
  Manage AI agents for the sow multi-agent system.

  Agents are roles (implementer, architect, reviewer, etc.) that can be
  spawned by the orchestrator to perform specialized tasks. Each agent
  has specific capabilities and prompts tailored to its role.

  Commands:
    list      List available agents
    spawn     Spawn an agent to execute a task
    resume    Resume a paused agent session

  Usage:
    sow agent [command]

  Available Commands:
    list        List available agents
    resume      Resume a paused agent session with feedback
    spawn       Spawn an agent to execute work

  Flags:
    -h, --help   help for agent

  Global Flags:
        --quiet     Suppress non-error output
        --verbose   Enable verbose output

  Use "sow agent [command] --help" for more information about a command.

--------------------------------------------------------------------------------
THINKING
--------------------------------------------------------------------------------
  The `sow agent log` command doesn't exist. Let me check what task tracking commands exist:

--------------------------------------------------------------------------------
TOOL: Bash
--------------------------------------------------------------------------------
  Description: Get task output help
  Command: sow task output add --help

--------------------------------------------------------------------------------
RESULT [OK]
--------------------------------------------------------------------------------
  Add an output artifact to a task.

  Creates a new output artifact with the specified type and path.
  The artifact is appended to the task's output list.

  Examples:
    # Add modified file
    sow task output add --id 010 --type modified --path src/auth/jwt.ts

    # Add with approval flag
    sow task output add --id 010 --type modified --path src/auth/verify.ts --approved

  Usage:
    sow task output add [flags]

  Flags:
        --approved       Mark artifact as approved
    -h, --help           help for add
        --id string      Task ID (required)
        --path string    Artifact path (required)
        --phase string   Target phase (defaults to current phase)
        --type string    Artifact type (required)

  Global Flags:
        --quiet     Suppress non-error output
        --verbose   Enable verbose output

--------------------------------------------------------------------------------
TOOL: Bash
--------------------------------------------------------------------------------
  Description: Track modified files
  Command: sow task output add --id 100 --type modified --path libs/project/README.md && \ sow task output add --id 100 --type modified --path libs/project/state/README.md && \ sow task output add --id 100 --typ...

--------------------------------------------------------------------------------
RESULT [OK]
--------------------------------------------------------------------------------
  Added output artifact [0] to task [100]
  Added output artifact [1] to task [100]
  Added output artifact [2] to task [100]
  Added output artifact [3] to task [100]

--------------------------------------------------------------------------------
TOOL: Bash
--------------------------------------------------------------------------------
  Description: Mark task for review
  Command: sow task set --id 100 status needs_review

--------------------------------------------------------------------------------
RESULT [OK]
--------------------------------------------------------------------------------
  Set status on task [100] in phase implementation

--------------------------------------------------------------------------------
THINKING
--------------------------------------------------------------------------------
  Now let me write a summary to the task log file:

--------------------------------------------------------------------------------
TOOL: Read
--------------------------------------------------------------------------------
  File: /Users/josh/code/sow/.sow/worktrees/feat/libsproject-module-118/.sow/project/phases/implementation/tasks/100/log.md

--------------------------------------------------------------------------------
RESULT [OK]
--------------------------------------------------------------------------------

--------------------------------------------------------------------------------
TOOL: Edit
--------------------------------------------------------------------------------
  File: /Users/josh/code/sow/.sow/worktrees/feat/libsproject-module-118/.sow/project/phases/implementation/tasks/100/log.md
  Replacing: # Task Log  Worker actions will be logged here.

--------------------------------------------------------------------------------
RESULT [OK]
--------------------------------------------------------------------------------

--------------------------------------------------------------------------------
THINKING
--------------------------------------------------------------------------------
  Task 100 is complete. Here's a summary:

  ## Task 100 Complete: Add README and Final Cleanup

  ### Files Modified
  1. **`libs/project/README.md`** - Created comprehensive documentation covering Quick Start, Usage, Package Structure, and Key Concepts
  2. **`libs/project/state/README.md`** - Created concise documentation for the state subpackage
  3. **`cli/internal/cmdutil/context.go`** - Fixed 3 wrapcheck lint errors by wrapping errors from `state.Load`, `state.Save`, and `state.Create`
  4. **`CHANGELO
    ... [truncated, 1012 total chars]

================================================================================
SESSION COMPLETE
================================================================================
  Duration: 7m 23s (API: 7m 25s)
  Turns: 74
  Cost: $3.19

  FINAL RESULT:
  Task 100 is complete. Here's a summary:

  ## Task 100 Complete: Add README and Final Cleanup

  ### Files Modified
  1. **`libs/project/README.md`** - Created comprehensive documentation covering Quick Start, Usage, Package Structure, and Key Concepts
  2. **`libs/project/state/README.md`** - Created concise documentation for the state subpackage
  3. **`cli/internal/cmdutil/context.go`** - Fixed 3 wrapcheck lint errors by wrapping errors from `state.Load`, `state.Save`, and `state.Create`
  4. **`CHANGELOG.md`** - Added Unreleased section documenting the libs/project module consolidation

  ### Verification Results
  - `golangci-lint run ./...` - **0 issues** in both libs/project and cli
  - `go test -race ./...` - **All tests pass** in libs/project, libs/project/state, and all cli packages

  ### All Acceptance Criteria Met
  - READMEs created following libs/config/ pattern
  - Linting passes with no issues
  - All tests pass with race detection
  - CHANGELOG updated
  - Doc comments complete
  - Code follows style guidelines
